{
  "pilot_id": "es-en-pilot-v2",
  "version": "2.0.0",
  "note": "Spanish Curriculum v2 — the reworked Units 1-12. Authored, not generated. See docs/HANDOFF.md 5b.",
  "section": {
    "section": 1,
    "title_es": "Primeros pasos",
    "description": "Twelve units that take you from your first Spanish word to a whole short conversation."
  },
  "units": [
    {
      "id": "es-en-p01-u01",
      "section": 1,
      "unit": 1,
      "title": "Your first words in Spanish",
      "cefr": "Intro",
      "score_range": "0-9",
      "communicative_goal": "Hear Spanish, read it aloud, and say your first five words.",
      "objective": "Hear Spanish, read it aloud, and say your first five words.",
      "scaffold": 5,
      "grammar_targets": [
        "sound and spelling"
      ],
      "vocabulary": [
        {
          "id": "es-en-s01-u002-v11",
          "spanish": "hola",
          "english": "hello",
          "part_of_speech": "expression",
          "status": "pilot_authored",
          "emoji": "👋"
        },
        {
          "id": "es-en-s01-u002-v06",
          "spanish": "gracias",
          "english": "thank you",
          "part_of_speech": "expression",
          "status": "pilot_authored",
          "emoji": "🙏"
        },
        {
          "id": "es-en-p01-u01-v03",
          "spanish": "sí",
          "english": "yes",
          "part_of_speech": "adverb",
          "status": "pilot_authored",
          "emoji": "✅"
        },
        {
          "id": "es-en-p01-u01-v04",
          "spanish": "no",
          "english": "no",
          "part_of_speech": "adverb",
          "status": "pilot_authored",
          "emoji": "❌"
        },
        {
          "id": "es-en-p01-u01-v05",
          "spanish": "español",
          "english": "Spanish",
          "part_of_speech": "noun",
          "status": "pilot_authored",
          "emoji": "🇪🇸"
        }
      ],
      "phrase_patterns": [
        {
          "id": "es-en-p01-u01-p02",
          "spanish": "Sí, gracias.",
          "english": "Yes, thank you.",
          "status": "pilot_authored"
        },
        {
          "id": "es-en-p01-u01-p03",
          "spanish": "No, gracias.",
          "english": "No, thank you.",
          "status": "pilot_authored"
        }
      ],
      "lesson_sequence": [
        {
          "lesson_index": 1,
          "name": "Discover",
          "goal": "Meet five Spanish words and connect sound to meaning."
        },
        {
          "lesson_index": 2,
          "name": "Notice the pattern",
          "goal": "Work out how three Spanish letters sound."
        },
        {
          "lesson_index": 3,
          "name": "Unit review",
          "goal": "Bring back everything from this unit."
        }
      ],
      "review_schedule_days": [
        1,
        3,
        7,
        14
      ],
      "unit_assessment": {
        "can_do_statement": "Hear Spanish, read it aloud, and say your first five words."
      },
      "notices": [
        {
          "id": "p01-u01-n01",
          "title": "Three letters that surprise you",
          "examples": [
            {
              "spanish": "hola",
              "english": "hello",
              "note": "the h is silent — say OH-la"
            },
            {
              "spanish": "español",
              "english": "Spanish",
              "note": "ñ sounds like the ny in canyon"
            },
            {
              "spanish": "gracias",
              "english": "thank you",
              "note": "c before i sounds like s"
            }
          ],
          "question": {
            "prompt": "The h in hola is silent. So how does hasta start?",
            "options": [
              "like asta",
              "with a breathy h",
              "like jasta"
            ],
            "answer": "like asta",
            "explanation": "The Spanish h is always silent — hola, hasta, hoy. You will never hear it, in any word.",
            "concepts": [
              "sound-spelling"
            ]
          }
        }
      ]
    },
    {
      "id": "es-en-p01-u02",
      "section": 1,
      "unit": 2,
      "title": "Greet someone and say goodbye",
      "cefr": "Intro",
      "score_range": "0-9",
      "communicative_goal": "Greet someone at any time of day, ask how they are, and say goodbye.",
      "objective": "Greet someone at any time of day, ask how they are, and say goodbye.",
      "scaffold": 5,
      "grammar_targets": [
        "greetings",
        "buenos and buenas"
      ],
      "vocabulary": [
        {
          "id": "es-en-s01-u002-v01",
          "spanish": "buenos días",
          "english": "good morning",
          "part_of_speech": "expression",
          "status": "pilot_authored",
          "emoji": "🌅"
        },
        {
          "id": "es-en-s01-u002-v02",
          "spanish": "buenas tardes",
          "english": "good afternoon",
          "part_of_speech": "expression",
          "status": "pilot_authored",
          "emoji": "🌇"
        },
        {
          "id": "es-en-s01-u002-v03",
          "spanish": "buenas noches",
          "english": "good evening",
          "part_of_speech": "expression",
          "status": "pilot_authored",
          "emoji": "🌙"
        },
        {
          "id": "es-en-s01-u002-v04",
          "spanish": "adiós",
          "english": "goodbye",
          "part_of_speech": "expression",
          "status": "pilot_authored",
          "emoji": "👋",
          "context_es": "Adiós. Hasta luego.",
          "context_en": "Goodbye. See you later."
        },
        {
          "id": "es-en-s01-u002-v05",
          "spanish": "hasta luego",
          "english": "see you later",
          "part_of_speech": "expression",
          "status": "pilot_authored"
        },
        {
          "id": "es-en-s01-u002-v07",
          "spanish": "de nada",
          "english": "you're welcome",
          "part_of_speech": "expression",
          "status": "pilot_authored",
          "context_es": "Gracias. De nada.",
          "context_en": "Thank you. You're welcome."
        },
        {
          "id": "es-en-s01-u001-v02",
          "spanish": "por favor",
          "english": "please",
          "part_of_speech": "expression",
          "status": "pilot_authored",
          "context_es": "Sí, por favor.",
          "context_en": "Yes, please."
        },
        {
          "id": "es-en-s01-u002-v12",
          "spanish": "cómo",
          "english": "how",
          "part_of_speech": "question word",
          "status": "pilot_authored",
          "context_es": "¿Cómo estás?",
          "context_en": "How are you?"
        },
        {
          "id": "es-en-s01-u002-v10",
          "spanish": "bien",
          "english": "well",
          "part_of_speech": "adverb",
          "status": "pilot_authored",
          "emoji": "👍",
          "context_es": "Estoy bien, gracias.",
          "context_en": "I am well, thank you."
        },
        {
          "id": "es-en-s01-u002-v13",
          "spanish": "estar",
          "english": "to be (right now)",
          "part_of_speech": "verb",
          "status": "pilot_authored"
        }
      ],
      "phrase_patterns": [
        {
          "id": "es-en-p01-u02-p01",
          "spanish": "Hola, ¿cómo estás?",
          "english": "Hello, how are you?",
          "status": "pilot_authored"
        },
        {
          "id": "es-en-p01-u02-p02",
          "spanish": "Estoy bien, gracias.",
          "english": "I am well, thank you.",
          "status": "pilot_authored"
        },
        {
          "id": "es-en-p01-u02-p04",
          "spanish": "Buenas noches. Adiós.",
          "english": "Good night. Goodbye.",
          "status": "pilot_authored"
        },
        {
          "id": "es-en-p01-u02-p05",
          "spanish": "Adiós, hasta luego.",
          "english": "Goodbye, see you later.",
          "status": "pilot_authored"
        },
        {
          "id": "es-en-p01-u02-p06",
          "spanish": "Sí, por favor. Gracias.",
          "english": "Yes, please. Thank you.",
          "status": "pilot_authored"
        }
      ],
      "lesson_sequence": [
        {
          "lesson_index": 1,
          "name": "Discover",
          "goal": "Meet the greetings, and hear when each one is used."
        },
        {
          "lesson_index": 2,
          "name": "Notice the pattern",
          "goal": "Work out why it is buenos días but buenas tardes."
        },
        {
          "lesson_index": 3,
          "name": "Build",
          "goal": "Put the greetings together into whole sentences."
        },
        {
          "lesson_index": 4,
          "name": "Use in context",
          "goal": "Greet a neighbour and take your leave."
        },
        {
          "lesson_index": 5,
          "name": "Unit review",
          "goal": "Bring back everything from this unit."
        }
      ],
      "review_schedule_days": [
        1,
        3,
        7,
        14
      ],
      "unit_assessment": {
        "can_do_statement": "Greet someone at any time of day, ask how they are, and say goodbye."
      },
      "notices": [
        {
          "id": "p01-u02-n01",
          "title": "Buenos or buenas?",
          "examples": [
            {
              "spanish": "buenos días",
              "english": "good morning",
              "note": "el día is masculine"
            },
            {
              "spanish": "buenas tardes",
              "english": "good afternoon",
              "note": "la tarde is feminine"
            },
            {
              "spanish": "buenas noches",
              "english": "good evening",
              "note": "la noche is feminine"
            }
          ],
          "question": {
            "prompt": "Spanish also wishes you good luck. La suerte is feminine. Which one is it?",
            "options": [
              "buena suerte",
              "bueno suerte",